{
  "$schema": "https://json-schema.org/draft/2020-12/schema",
  "$id": "https://tierlistbuilder.local/schemas/seed-compiled-manifest.schema.json",
  "title": "Tierlistbuilder Seed Compiled Manifest",
  "type": "object",
  "additionalProperties": false,
  "required": [
    "schemaVersion",
    "datasetKey",
    "releaseId",
    "sourceManifestPath",
    "generatedAt",
    "variantSpecVersion",
    "totals",
    "templates",
    "warnings",
    "errors"
  ],
  "properties": {
    "schemaVersion": {
      "const": 1
    },
    "datasetKey": {
      "$ref": "#/$defs/datasetKey"
    },
    "releaseId": {
      "$ref": "#/$defs/releaseId"
    },
    "sourceManifestPath": {
      "type": "string",
      "minLength": 1
    },
    "generatedAt": {
      "type": "string",
      "pattern": "^\\d{4}-\\d{2}-\\d{2}T\\d{2}:\\d{2}:\\d{2}\\.\\d{3}Z$"
    },
    "variantSpecVersion": {
      "type": "string",
      "minLength": 1,
      "maxLength": 64
    },
    "totals": {
      "$ref": "#/$defs/totals"
    },
    "templates": {
      "type": "array",
      "minItems": 1,
      "items": {
        "$ref": "#/$defs/template"
      }
    },
    "warnings": {
      "type": "array",
      "items": {
        "$ref": "#/$defs/diagnostic"
      }
    },
    "errors": {
      "type": "array",
      "items": {
        "$ref": "#/$defs/diagnostic"
      }
    }
  },
  "$defs": {
    "datasetKey": {
      "type": "string",
      "minLength": 1,
      "maxLength": 64,
      "pattern": "^[a-z0-9]+(?:-[a-z0-9]+)*$"
    },
    "releaseId": {
      "type": "string",
      "minLength": 1,
      "maxLength": 96,
      "pattern": "^[0-9a-z]+(?:-[0-9a-z]+)*$"
    },
    "templateExternalId": {
      "type": "string",
      "minLength": 3,
      "maxLength": 96,
      "pattern": "^[a-z0-9]+(?::[a-z0-9]+(?:-[a-z0-9]+)*)+$"
    },
    "entryExternalId": {
      "type": "string",
      "minLength": 1,
      "maxLength": 80,
      "pattern": "^[a-z0-9]+(?:-[a-z0-9]+)*$"
    },
    "hash": {
      "type": "string",
      "pattern": "^[0-9a-f]{64}$"
    },
    "mimeType": {
      "enum": ["image/jpeg", "image/png", "image/webp", "image/gif"]
    },
    "category": {
      "enum": [
        "gaming",
        "movies",
        "anime",
        "music",
        "sports",
        "food",
        "books",
        "tech",
        "other"
      ]
    },
    "visibility": {
      "enum": ["public", "unlisted"]
    },
    "labelPolicy": {
      "enum": [
        "explicit-required",
        "explicit-or-filename-fallback",
        "filename-derived",
        "hidden"
      ]
    },
    "totals": {
      "type": "object",
      "additionalProperties": false,
      "required": [
        "templateCount",
        "itemCount",
        "criterionCount",
        "sourceImageCount",
        "variantCount",
        "estimatedUploadBytes",
        "estimatedStorageBytes"
      ],
      "properties": {
        "templateCount": {
          "type": "integer",
          "minimum": 0
        },
        "itemCount": {
          "type": "integer",
          "minimum": 0
        },
        "criterionCount": {
          "type": "integer",
          "minimum": 0
        },
        "sourceImageCount": {
          "type": "integer",
          "minimum": 0
        },
        "variantCount": {
          "type": "integer",
          "minimum": 0
        },
        "estimatedUploadBytes": {
          "type": "integer",
          "minimum": 0
        },
        "estimatedStorageBytes": {
          "type": "integer",
          "minimum": 0
        }
      }
    },
    "template": {
      "type": "object",
      "additionalProperties": false,
      "required": [
        "externalId",
        "folder",
        "title",
        "category",
        "description",
        "tags",
        "visibility",
        "labelPolicy",
        "criteria",
        "items"
      ],
      "properties": {
        "externalId": {
          "$ref": "#/$defs/templateExternalId"
        },
        "folder": {
          "type": "string",
          "minLength": 1
        },
        "title": {
          "type": "string",
          "minLength": 1,
          "maxLength": 80
        },
        "category": {
          "$ref": "#/$defs/category"
        },
        "description": {
          "type": ["string", "null"],
          "maxLength": 500
        },
        "tags": {
          "type": "array",
          "maxItems": 12,
          "items": {
            "type": "string",
            "minLength": 1,
            "maxLength": 32
          }
        },
        "visibility": {
          "$ref": "#/$defs/visibility"
        },
        "labelPolicy": {
          "$ref": "#/$defs/labelPolicy"
        },
        "coverImage": {
          "$ref": "#/$defs/compiledAsset"
        },
        "coverZoom": {
          "type": "number",
          "minimum": 0.1,
          "maximum": 10
        },
        "criteria": {
          "type": "array",
          "minItems": 1,
          "maxItems": 8,
          "items": {
            "$ref": "#/$defs/criterion"
          }
        },
        "items": {
          "type": "array",
          "minItems": 1,
          "items": {
            "$ref": "#/$defs/item"
          }
        }
      }
    },
    "criterion": {
      "type": "object",
      "additionalProperties": false,
      "required": [
        "externalId",
        "name",
        "shortName",
        "prompt",
        "axisTop",
        "axisBottom",
        "order",
        "isPrimary",
        "status"
      ],
      "properties": {
        "externalId": {
          "$ref": "#/$defs/entryExternalId"
        },
        "name": {
          "type": "string",
          "minLength": 1,
          "maxLength": 40
        },
        "shortName": {
          "type": ["string", "null"],
          "maxLength": 16
        },
        "prompt": {
          "type": "string",
          "minLength": 1,
          "maxLength": 160
        },
        "axisTop": {
          "type": ["string", "null"],
          "maxLength": 40
        },
        "axisBottom": {
          "type": ["string", "null"],
          "maxLength": 40
        },
        "order": {
          "type": "integer",
          "minimum": 0
        },
        "isPrimary": {
          "type": "boolean"
        },
        "status": {
          "enum": ["active", "hidden", "deprecated"]
        }
      }
    },
    "item": {
      "type": "object",
      "additionalProperties": false,
      "required": ["externalId", "order", "image", "label", "asset"],
      "properties": {
        "externalId": {
          "$ref": "#/$defs/entryExternalId"
        },
        "order": {
          "type": "integer",
          "minimum": 0
        },
        "image": {
          "type": "string",
          "minLength": 1
        },
        "label": {
          "type": "string",
          "minLength": 1,
          "maxLength": 120
        },
        "asset": {
          "$ref": "#/$defs/compiledAsset"
        }
      }
    },
    "compiledAsset": {
      "type": "object",
      "additionalProperties": false,
      "required": [
        "sourcePath",
        "sourcePathRelative",
        "sourceSha256",
        "sourceMimeType",
        "sourceByteSize",
        "sourceWidth",
        "sourceHeight",
        "sourceAspectRatio",
        "crop",
        "variants"
      ],
      "properties": {
        "sourcePath": {
          "type": "string",
          "minLength": 1
        },
        "sourcePathRelative": {
          "type": "string",
          "minLength": 1
        },
        "sourceSha256": {
          "$ref": "#/$defs/hash"
        },
        "sourceMimeType": {
          "$ref": "#/$defs/mimeType"
        },
        "sourceByteSize": {
          "type": "integer",
          "minimum": 1
        },
        "sourceWidth": {
          "type": "integer",
          "minimum": 1
        },
        "sourceHeight": {
          "type": "integer",
          "minimum": 1
        },
        "sourceAspectRatio": {
          "type": "number",
          "exclusiveMinimum": 0
        },
        "crop": {
          "oneOf": [
            {
              "type": "null"
            },
            {
              "$ref": "#/$defs/crop"
            }
          ]
        },
        "variants": {
          "type": "object",
          "additionalProperties": false,
          "required": ["tile", "preview"],
          "properties": {
            "tile": {
              "$ref": "#/$defs/variant"
            },
            "preview": {
              "$ref": "#/$defs/variant"
            }
          }
        }
      }
    },
    "crop": {
      "type": "object",
      "additionalProperties": false,
      "required": ["x", "y", "width", "height"],
      "properties": {
        "x": {
          "type": "number"
        },
        "y": {
          "type": "number"
        },
        "width": {
          "type": "number",
          "exclusiveMinimum": 0
        },
        "height": {
          "type": "number",
          "exclusiveMinimum": 0
        }
      }
    },
    "variant": {
      "type": "object",
      "additionalProperties": false,
      "required": [
        "kind",
        "path",
        "contentHash",
        "mimeType",
        "byteSize",
        "width",
        "height",
        "cacheKey"
      ],
      "properties": {
        "kind": {
          "enum": ["tile", "preview"]
        },
        "path": {
          "type": "string",
          "minLength": 1
        },
        "contentHash": {
          "$ref": "#/$defs/hash"
        },
        "mimeType": {
          "$ref": "#/$defs/mimeType"
        },
        "byteSize": {
          "type": "integer",
          "minimum": 1
        },
        "width": {
          "type": "integer",
          "minimum": 1
        },
        "height": {
          "type": "integer",
          "minimum": 1
        },
        "cacheKey": {
          "type": "string",
          "minLength": 1
        }
      }
    },
    "diagnostic": {
      "type": "object",
      "additionalProperties": false,
      "required": ["code", "message", "path", "severity"],
      "properties": {
        "code": {
          "type": "string",
          "minLength": 1,
          "maxLength": 80
        },
        "message": {
          "type": "string",
          "minLength": 1
        },
        "path": {
          "type": "string",
          "minLength": 1
        },
        "severity": {
          "enum": ["warning", "error"]
        }
      }
    }
  }
}
